{
  "$schema": "https://json-schema.org/draft/2020-12/schema",
  "$id": "https://burrow.local/schema/pipeline.json",
  "title": "Burrow pipeline (SPEC 6), spike version",
  "type": "object",
  "required": ["version", "id", "trigger", "steps"],
  "additionalProperties": false,
  "properties": {
    "version": { "const": 1 },
    "id": { "$ref": "#/$defs/id" },
    "description": { "type": "string", "maxLength": 2000 },
    "trigger": {
      "type": "object",
      "additionalProperties": false,
      "properties": {
        "schedule": { "type": "string", "format": "cron" },
        "timezone": { "type": "string", "format": "iana-tz" },
        "catch_up": { "enum": ["once", "skip"] },
        "manual": { "type": "boolean" }
      },
      "anyOf": [
        { "required": ["schedule"] },
        { "required": ["manual"], "properties": { "manual": { "const": true } } }
      ]
    },
    "inputs": {
      "type": "object",
      "propertyNames": { "$ref": "#/$defs/id" },
      "additionalProperties": {
        "type": "object",
        "additionalProperties": false,
        "required": ["type"],
        "properties": {
          "type": { "enum": ["string", "number", "boolean", "date"] },
          "default": true,
          "description": { "type": "string" }
        }
      }
    },
    "steps": { "type": "array", "minItems": 1, "items": { "$ref": "#/$defs/step" } },
    "on_error": { "enum": ["stop", "continue"] },
    "timeout": { "type": "string", "format": "go-duration" }
  },
  "$defs": {
    "id": { "type": "string", "pattern": "^[a-z][a-z0-9_]*$", "maxLength": 64 },
    "expr": { "type": "string", "pattern": "^\\$\\{\\{.*\\}\\}$" },
    "int_or_expr": { "anyOf": [ { "type": "integer", "minimum": 1 }, { "$ref": "#/$defs/expr" } ] },
    "list_or_expr": { "anyOf": [ { "type": "array" }, { "$ref": "#/$defs/expr" } ] },
    "object_or_expr": { "anyOf": [ { "type": "object" }, { "$ref": "#/$defs/expr" } ] },
    "step": {
      "type": "object",
      "required": ["id", "use"],
      "additionalProperties": false,
      "properties": {
        "id": { "$ref": "#/$defs/id" },
        "use": {
          "enum": ["http.get", "http.download", "web.search", "html.extract", "json.extract",
                   "transform.map", "transform.filter", "db.query", "db.insert", "db.insert_many",
                   "db.update", "llm.select", "llm.extract", "bucket.put", "bucket.list",
                   "app.notify", "script.starlark"]
        },
        "with": { "type": "object" },
        "if": { "type": "string" },
        "for_each": { "type": "string" },
        "retry": {
          "type": "object",
          "additionalProperties": false,
          "properties": {
            "max": { "type": "integer", "minimum": 0, "maximum": 10 },
            "backoff": { "type": "string", "format": "go-duration" }
          }
        },
        "timeout": { "type": "string", "format": "go-duration" },
        "continue_on_error": { "type": "boolean" }
      },
      "allOf": [
        { "if": { "properties": { "use": { "const": "http.get" } }, "required": ["use"] },
          "then": { "properties": { "with": { "$ref": "#/$defs/with_http_get" } }, "required": ["with"] } },
        { "if": { "properties": { "use": { "const": "web.search" } }, "required": ["use"] },
          "then": { "properties": { "with": { "$ref": "#/$defs/with_web_search" } }, "required": ["with"] } },
        { "if": { "properties": { "use": { "const": "db.query" } }, "required": ["use"] },
          "then": { "properties": { "with": { "$ref": "#/$defs/with_db_query" } }, "required": ["with"] } },
        { "if": { "properties": { "use": { "const": "db.insert" } }, "required": ["use"] },
          "then": { "properties": { "with": { "$ref": "#/$defs/with_db_insert" } }, "required": ["with"] } },
        { "if": { "properties": { "use": { "const": "db.insert_many" } }, "required": ["use"] },
          "then": { "properties": { "with": { "$ref": "#/$defs/with_db_insert_many" } }, "required": ["with"] } },
        { "if": { "properties": { "use": { "const": "llm.select" } }, "required": ["use"] },
          "then": { "properties": { "with": { "$ref": "#/$defs/with_llm_select" } }, "required": ["with"] } },
        { "if": { "properties": { "use": { "const": "transform.map" } }, "required": ["use"] },
          "then": { "properties": { "with": { "$ref": "#/$defs/with_transform_map" } }, "required": ["with"] } },
        { "if": { "properties": { "use": { "const": "app.notify" } }, "required": ["use"] },
          "then": { "properties": { "with": { "$ref": "#/$defs/with_app_notify" } }, "required": ["with"] } }
      ]
    },
    "with_http_get": {
      "type": "object",
      "required": ["url"],
      "additionalProperties": false,
      "properties": {
        "url": { "type": "string", "format": "http-url" },
        "query": { "type": "object", "additionalProperties": { "type": ["string", "number", "boolean"] } },
        "headers": { "type": "object", "additionalProperties": { "type": "string" } },
        "timeout": { "type": "string", "format": "go-duration" },
        "fail_on_status": { "type": "boolean" }
      }
    },
    "with_web_search": {
      "type": "object",
      "required": ["query"],
      "additionalProperties": false,
      "properties": {
        "query": { "type": "string", "minLength": 1 },
        "limit": { "$ref": "#/$defs/int_or_expr" },
        "freshness": { "enum": ["day", "week", "month", "any"] }
      }
    },
    "with_db_query": {
      "type": "object",
      "required": ["sql"],
      "additionalProperties": false,
      "properties": {
        "sql": { "type": "string", "minLength": 1 },
        "params": { "type": "object" }
      }
    },
    "with_db_insert": {
      "type": "object",
      "required": ["table", "row"],
      "additionalProperties": false,
      "properties": {
        "table": { "$ref": "#/$defs/id" },
        "row": { "$ref": "#/$defs/object_or_expr" },
        "on_conflict": { "enum": ["error", "ignore", "upsert"] },
        "conflict_key": { "type": ["string", "array"], "items": { "type": "string" } }
      }
    },
    "with_db_insert_many": {
      "type": "object",
      "required": ["table", "rows"],
      "additionalProperties": false,
      "properties": {
        "table": { "$ref": "#/$defs/id" },
        "rows": { "$ref": "#/$defs/list_or_expr" },
        "on_conflict": { "enum": ["error", "ignore", "upsert"] },
        "conflict_key": { "type": ["string", "array"], "items": { "type": "string" } }
      }
    },
    "with_llm_select": {
      "type": "object",
      "required": ["items", "instruction", "count"],
      "additionalProperties": false,
      "properties": {
        "items": { "$ref": "#/$defs/list_or_expr" },
        "instruction": { "type": "string", "minLength": 1 },
        "count": { "$ref": "#/$defs/int_or_expr" },
        "add": { "type": "object", "additionalProperties": { "enum": ["string", "number", "boolean"] } },
        "model": { "type": "string" },
        "max_input_tokens": { "type": "integer", "minimum": 100 }
      }
    },
    "with_transform_map": {
      "type": "object",
      "required": ["items", "fields"],
      "additionalProperties": false,
      "properties": {
        "items": { "$ref": "#/$defs/list_or_expr" },
        "fields": { "type": "object", "minProperties": 1, "additionalProperties": { "type": "string" } }
      }
    },
    "with_app_notify": {
      "type": "object",
      "required": ["title", "message"],
      "additionalProperties": false,
      "properties": {
        "title": { "type": "string" },
        "message": { "type": "string" },
        "level": { "enum": ["info", "warning"] }
      }
    }
  }
}
